{"schemaVersion":"harmonic-orrery.evidence-bundle.v1","bundleId":"EVIDENCE_BUNDLE_A012_v1","harmonicDescriptorBinding":{"candidateId":"CH_A012_q_v1","coordinateId":"harmonic.CH_A012_q_v1","releaseId":"harmonic-compression-candidate:CH_A012_q_v1:1.0.0","status":"admitted_scoped_A012","candidateFingerprint":"b2e57f6b0e2d8ac10113dc1861430ff5c205dedb8b079312232b2a76f167df5f"},"legalMoveCatalogBinding":{"schemaVersion":"harmonic-orrery.legal-moves.v2","catalogId":"harmonic-orrery.parallel-anchor-edges.v1","catalogFingerprint":"8a4b1b58f562502eb6b149d8d5cb9223fc0ed69007004d7d2466f7bd58f2e48d"},"sources":[{"artifact":"canonical/harmonic-compression-candidates/CH_A012_q_v1.json","sha256":"2c6ffae3acc7d5e6bc7154783967ad463d99fab96c0e410b69b27fb21af59c6e","role":"A0-A2 anchor harmonic descriptor"},{"artifact":"orrery/src/generated/legal-moves.v2.json","sha256":"c017c3c66e10b803eccb82342d030575c8069434063657fb89b5d56169db4d4b","role":"legal-move catalog bytes"},{"artifact":"docs/A_TIER_TRIADIC_COMPRESSION_THEOREM.md","sha256":"918ff18598a108cc4259cc7e190df911efafa92c524de29b62c65bd933091253","role":"scoped research theorem"},{"artifact":"schemas/governors.yaml","sha256":"841fc52f1874de28d98a79e1635cbdd8ece134792a2a1f48ccb7e11a7a534ad2","role":"machine governor registry"}],"labelMap":{"stateGovernor":{"label":"State Governor","source":"canonical/harmonic-compression-candidates/CH_A012_q_v1.json:records[i].stateGovernor","note":"categorical office; never inferred from W_A012","absentValue":"unavailable"},"tier":{"label":"Tier band","source":"canonical/harmonic-compression-candidates/CH_A012_q_v1.json:records[i].tier","note":"topology precedence, not a score","absentValue":"unavailable"},"forteFamily":{"label":"Forte family","source":"canonical/harmonic-compression-candidates/CH_A012_q_v1.json:records[i].forte","absentValue":"unavailable"},"pitchClasses":{"label":"Pitch-class mask","source":"canonical/harmonic-compression-candidates/CH_A012_q_v1.json:records[i].pitchClasses","note":"rooted to pitch class 0; mask equals stateId","absentValue":"unavailable"},"stateGovernorDegree":{"label":"Degree Governor address","source":"canonical/harmonic-compression-candidates/CH_A012_q_v1.json:records[i].stateGovernorDegree","note":"Chaldean degree address; separate from the State Governor office","absentValue":"unavailable"},"triadicCompressionSignature":{"label":"Q(S) triadic-compression signature","source":"canonical/harmonic-compression-candidates/CH_A012_q_v1.json:records[i].triadicCompressionSignature","note":"seven positions, q_v1 classes 0..3","absentValue":"unavailable"},"weightedProjection":{"label":"W_A012 scoped anchor weight","source":"canonical/harmonic-compression-candidates/CH_A012_q_v1.json:records[i].weightedProjection","note":"exact rational numerator/407; never a float","wording":"unique max-margin optimum under the declared objective","wordingNote":"method.uniquenessClaim=false remains true outside the declared max-margin objective","absentValue":"unavailable"},"certificate":{"label":"Certificate status","source":"canonical/harmonic-compression-candidates/CH_A012_q_v1.json:certificate","note":"unique max-margin optimum under the declared LP objective","activeSetLabel":"active-set rank 8 (7 binding + normalization)","absentValue":"unavailable"},"wavelength":{"label":"Representative wavelength","source":"schemas/harmonic-orrery-nodes.schema.json:photonic.representativeWavelengthNm","note":"photonic layer, not the harmonic coordinate","absentValue":"unavailable"},"photonicCompression":{"label":"Photonic compression (C_P)","source":"schemas/harmonic-orrery-nodes.schema.json:photonic.photonicCompression","note":"photonic layer; not W_A012 and not C_H","absentValue":"unavailable"},"admissionStatus":{"label":"Admission status","source":"canonical/harmonic-compression-candidates/CH_A012_q_v1.json:status","absentValue":"unavailable"},"globalAggregate":{"label":"Global harmonic aggregate","source":"canonical/harmonic-compression-candidates/CH_A012_q_v1.json:globalAggregate","note":"C_H stays unresolved null; the guard literal is displayed, never a number","absentValue":"unresolved"},"provenance":{"label":"Provenance","source":"canonical/harmonic-compression-candidates/CH_A012_q_v1.json:sourceBindings","note":"source SHA-256 bindings from the pinned sidecar","absentValue":"unavailable"}},"method":{"algorithmVersion":"gov-213.rooted-triad-q-v1.v1","qClasses":[{"runtimeQuality":"major","signature":[4,7],"value":0},{"runtimeQuality":"minor","signature":[3,7],"value":1},{"runtimeQuality":"diminished","signature":[3,6],"value":2},{"runtimeQuality":"augmented","signature":[4,8],"value":2},{"runtimeQuality":"other","signature":[2,6],"value":3},{"runtimeQuality":"other","signature":[4,6],"value":3}],"governorDegreeMap":{"Jupiter":2,"Mars":3,"Mercury":6,"Moon":7,"Saturn":1,"Sun":4,"Venus":5},"degreeOrder":[1,2,3,4,5,6,7],"weightDenominator":407,"weightNumerators":[116,56,41,35,77,44,38],"weightOrdering":"w1>w5>w2>w6>w3>w7>w4>0","weightSum":{"denominator":407,"numerator":407},"uniquenessClaim":false},"certificate":{"epsilonStar":{"denominator":407,"numerator":3},"nextTightestSlack":{"denominator":407,"numerator":6,"pair":"Acoustic-Phrygian"},"tightSet":["w6-w3","w3-w7","w7-w4","Aeolian-Dorian","Phrygian-Aeolian","Locrian-Phrygian","Acoustic-Locrian"],"activeSetLabel":"active-set rank 8 (7 binding + normalization)","optimalityClaim":"unique_max_margin","witness":{"weightDenominator":407,"weightNumerators":[116,56,41,35,77,44,38]},"dualCertificate":{"bindingConstraints":["w6-w3","w3-w7","w7-w4","Aeolian-Dorian","Phrygian-Aeolian","Locrian-Phrygian","Acoustic-Locrian"],"lambdaDenominator":407,"lambdaNumerators":[122,101,67,63,30,17,7],"sumLambda":{"denominator":407,"numerator":407}},"verifier":"src/governor/certificate_verifier.py"},"invariants":{"a0A1Gap":{"denominator":407,"numerator":3},"a1A2Gap":{"denominator":407,"numerator":22},"tierSumOrder":[5,8,13],"strictBandSeparation":true},"globalAggregate":{"namespace":"harmonic.C_H","status":"unresolved","value":null,"guardLiteral":"C_H is a derived harmonic property, not a photonic measurement, not C_P, not C_S, not kappa_court, and not a thermodynamic quantity: not temperature, entropy, enthalpy, or free energy."},"records":[{"stateId":1387,"name":"Locrian","tier":"A0","forteFamily":"7-35","stateGovernor":"Saturn","stateGovernorDegree":1,"pitchClasses":[0,1,3,5,6,8,10],"intervalVector":[2,5,4,3,6,1],"governorSeatCompressionClass":2,"triadicCompressionSignature":[2,0,1,1,0,0,1],"weightedProjection":{"numerator":346,"denominator":407},"wA012Wording":"unique max-margin optimum under the declared objective","recordFingerprint":"14095730cb7f0bbfae3ece712692c434a76398395c82902845229b0bb6960735"},{"stateId":1451,"name":"Phrygian","tier":"A0","forteFamily":"7-35","stateGovernor":"Venus","stateGovernorDegree":5,"pitchClasses":[0,1,3,5,7,8,10],"intervalVector":[2,5,4,3,6,1],"governorSeatCompressionClass":2,"triadicCompressionSignature":[1,0,0,1,2,0,1],"weightedProjection":{"numerator":343,"denominator":407},"wA012Wording":"unique max-margin optimum under the declared objective","recordFingerprint":"edd045cea12875ef823fd8ea9125e25ec4b4754276cbf101a56a1f7a322c692c"},{"stateId":1453,"name":"Aeolian","tier":"A0","forteFamily":"7-35","stateGovernor":"Jupiter","stateGovernorDegree":2,"pitchClasses":[0,2,3,5,7,8,10],"intervalVector":[2,5,4,3,6,1],"governorSeatCompressionClass":2,"triadicCompressionSignature":[1,2,0,1,1,0,0],"weightedProjection":{"numerator":340,"denominator":407},"wA012Wording":"unique max-margin optimum under the declared objective","recordFingerprint":"5559bb965648b1cf321d8c7fba5a4e1987b8bba085e3aff60427e0da277e1ef3"},{"stateId":1709,"name":"Dorian","tier":"A0","forteFamily":"7-35","stateGovernor":"Mercury","stateGovernorDegree":6,"pitchClasses":[0,2,3,5,7,9,10],"intervalVector":[2,5,4,3,6,1],"governorSeatCompressionClass":2,"triadicCompressionSignature":[1,1,0,0,1,2,0],"weightedProjection":{"numerator":337,"denominator":407},"wA012Wording":"unique max-margin optimum under the declared objective","recordFingerprint":"39d0e25792e364d30a67e011b0294090ae548d47c7216c4007afd7672830bf45"},{"stateId":1717,"name":"Mixolydian","tier":"A0","forteFamily":"7-35","stateGovernor":"Mars","stateGovernorDegree":3,"pitchClasses":[0,2,4,5,7,9,10],"intervalVector":[2,5,4,3,6,1],"governorSeatCompressionClass":2,"triadicCompressionSignature":[0,1,2,0,1,1,0],"weightedProjection":{"numerator":259,"denominator":407},"wA012Wording":"unique max-margin optimum under the declared objective","recordFingerprint":"9009fd95ab597802e055aa1fa8d4d71e3cd2fa4835c60c5cef34cc40a76f6d52"},{"stateId":2741,"name":"Ionian","tier":"A0","forteFamily":"7-35","stateGovernor":"Moon","stateGovernorDegree":7,"pitchClasses":[0,2,4,5,7,9,11],"intervalVector":[2,5,4,3,6,1],"governorSeatCompressionClass":2,"triadicCompressionSignature":[0,1,1,0,0,1,2],"weightedProjection":{"numerator":217,"denominator":407},"wA012Wording":"unique max-margin optimum under the declared objective","recordFingerprint":"b42defc0282901397cc5c202daf085aa8853c6d4429ca739731ca7aed7dd78d1"},{"stateId":2773,"name":"Lydian","tier":"A0","forteFamily":"7-35","stateGovernor":"Sun","stateGovernorDegree":4,"pitchClasses":[0,2,4,6,7,9,11],"intervalVector":[2,5,4,3,6,1],"governorSeatCompressionClass":2,"triadicCompressionSignature":[0,0,1,2,0,1,1],"weightedProjection":{"numerator":193,"denominator":407},"wA012Wording":"unique max-margin optimum under the declared objective","recordFingerprint":"b55094bf613e4b7d3d98fa23d81947212eacd3061d1acce0a0566c1ab6a3ba41"},{"stateId":1371,"name":"Superlocrian","tier":"A1","forteFamily":"7-34","stateGovernor":"Sun","stateGovernorDegree":4,"pitchClasses":[0,1,3,4,6,8,10],"intervalVector":[2,5,4,4,4,2],"governorSeatCompressionClass":2,"triadicCompressionSignature":[2,1,1,2,0,0,2],"weightedProjection":{"numerator":475,"denominator":407},"wA012Wording":"unique max-margin optimum under the declared objective","recordFingerprint":"d62854d515ba36